{
  "paymentCardType": "consectetur",
  "name": "deserunt esse",
  "id": "qui non fugiat est",
  "cardHolderName": "nisi exercitation",
  "paymentMethodStatus": "ullamco nulla cupidatat tempor minim",
  "expirationYear": "Duis in deserunt aliquip",
  "expirationMonth": "pariatur cillum sint veniam ex",
  "numberLastDigits": "consequat sunt do sit",
  "maskedNumber": "dolore",
  "issueNumber": "voluptate sint quis dolore",
  "cardToken": "eu culpa",
  "companyName": "qui in in",
  "billToFirstName": "Ut deserunt tempor exercitation aute",
  "billToStreet2": "incididunt ad dolore",
  "billToStreet": "esse tempor consequat"
}
