{
  "paymentCardType": "est",
  "name": "id sed",
  "id": "dolore ex",
  "cardHolderName": "sit tempor qui ad et",
  "paymentMethodStatus": "veniam ullamco",
  "expirationYear": "exercitation pariatur",
  "expirationMonth": "cupidatat nulla aliquip",
  "numberLastDigits": "qui sint id Excepteur",
  "maskedNumber": "cupidatat reprehenderit aute",
  "issueNumber": "culpa veniam exercitation",
  "cardToken": "aute et ad do exercitation"
}
